{"schema_version":"0.2-proposal","event_type":"HORIZON_PROPOSAL_EVENT","id":"HORIZON-PROP-20260628-001","created_at":"2026-06-28T18:36:20Z","trigger":"User supplied critique that Horizon Weaver risks becoming approval-friendly rather than preserving uncomfortable map shifts.","current_frame":"Horizon v0.1 is a Builder-safe dry-run map-shift layer with local-only proposal/epoch logs and approval gates before canon or live mutation.","proposed_frame_shift":"Add HORIZON_PROPOSAL_EVENT plus REJECTED_HORIZON_REVIEW and AUTONOMY_LADDER as L1/L2 governance receipts between Dream/Sense and canon gates.","why_now":"Uploaded Horizon Weaver transcript and user synthesis identify a behavioral risk: the agent may learn to guess the operator instead of preserving disagreement.","evidence_available":["/workspace/user_files/05-_-_-_-_-_-_transcription_20260628_150851.txt","/workspace/user_files/01-md","/workspace/user_files/04-Iskra-.md","/workspace/memory/imports/2026-06-27-iskra-vomega7-workspace-agent-alignment-update/agent_files/files_for_agent_builder/10_HORIZON_WEAVER.md","github:serhiipriadko2-sys/iskra@main:dist/agent-builder/iskra-full-canon-unified-2026-06-10/agent_files/files_for_agent_builder/10_HORIZON_WEAVER.md#sha=4cdb33927256d4a5e793037657133cd51827b8f3","/workspace/memory/horizon/README.md","/workspace/memory/horizon/HORIZON_PROPOSAL_EVENT_SCHEMA.json","/workspace/memory/horizon/REJECTED_HORIZON_REVIEW_SCHEMA.json","/workspace/memory/horizon/validate_horizon_v0_2.py","/workspace/memory/horizon/rejected_horizon_review.example.json"],"missing_evidence":["GitHub/Builder mirror plan if this becomes package behavior","Periodic review runner or documented manual review cadence","Live Builder verification if mirrored"],"expected_discomfort":"This makes refusal and architect/operator disagreement durable instead of letting rejection quietly end the proposal.","operator_bias_risk":"The agent can optimize proposals for what Semen or another operator is likely to approve, hiding the real horizon shift under agreeable language. The receipt must therefore state discomfort, loss-on-rejection, proposal risk, and reopen evidence explicitly.","safety_scope":"Local Memory Horizon receipt only; no direct canon, ledger, live security policy, Builder, GitHub, Supabase, workflow, or runtime config mutation.","proposed_action":"Record v0.2 as accepted-memory governance; require operator_bias_risk in future Horizon proposal events; add rejected-horizon review mechanism and autonomy ladder; defer GitHub/Builder mirror until explicit mirror approval.","rejected_alternatives":["Give Horizon direct canon mutation rights","Keep Horizon as dry-run only with no durable rejected-proposal memory","Treat human approval as the beginning of evolution rather than the gate for canon change"],"review_status":"ADR_CANDIDATE","forbidden":["DIRECT_CANON_MUTATION","SILENT_LEDGER_WRITE","LIVE_SECURITY_POLICY_CHANGE"],"autonomy_level":"L1","linked_adr":"ADR-ACCEPTED-20260628-horizon-proposal-review-autonomy-ladder","adoml":{"delta":"Horizon gains an accepted-memory L1 receipt for attempts to shift the map without changing canon.","D":"User critique plus uploaded transcripts, GitHub current Horizon v0.1 docs, Memory import, local schema, validator, and rejected-review example.","omega":0.88,"lambda":"Reopen after GitHub/Builder mirror, package tests, live verification, or evidence that rejected dry-run horizons are being lost."}}
